{
  "id": "kaikki-mandarin-chinese",
  "name": "Kaikki Wiktionary Mandarin Chinese",
  "version": "2026.09.06",
  "schema_version": 1,
  "languages": ["zh"],
  "created_at": "2026-09-11T12:00:00Z",
  "license": "CC-BY-SA-3.0",
  "sources": [
    {
      "id": "kaikki-wiktionary",
      "name": "Kaikki.org Wiktionary Extracted Dictionary",
      "url": "https://kaikki.org/",
      "license": "CC-BY-SA-3.0",
      "attribution": "Extracted from Wiktionary via Wiktextract and Kaikki.org"
    }
  ]
}
