{
  "id": "kaikki-fr",
  "name": "Kaikki English Wiktionary (French entries) — French",
  "version": "2026.09.12",
  "schema_version": 2,
  "languages": [
    "fr"
  ],
  "created_at": "2026-09-12T19:48:47Z",
  "license": "CC-BY-SA-4.0",
  "sources": [
    {
      "id": "kaikki-wiktionary",
      "name": "Kaikki.org Wiktextract — English Wiktionary (French entries)",
      "url": "https://kaikki.org/dictionary/French/kaikki.org-dictionary-French.jsonl",
      "license": "CC-BY-SA-4.0",
      "attribution": "English Wiktionary (French entries) contributors, extracted via Wiktextract and published by Kaikki.org. Retrieved Wed, 09 Sep 2026 21:01:41 GMT. Source SHA-256 (first 64 MB): 9594b5dc75732dde6a356569f8808bdac8f9cdd6d4b6c4f8ea1ea0dd0b09b8b1"
    }
  ]
}
