{
  "id": "kaikki-ca",
  "name": "Kaikki English Wiktionary (Catalan entries) — Catalan",
  "version": "2026.09.12",
  "schema_version": 2,
  "languages": [
    "ca"
  ],
  "created_at": "2026-09-12T19:48:24Z",
  "license": "CC-BY-SA-4.0",
  "sources": [
    {
      "id": "kaikki-wiktionary",
      "name": "Kaikki.org Wiktextract — English Wiktionary (Catalan entries)",
      "url": "https://kaikki.org/dictionary/Catalan/kaikki.org-dictionary-Catalan.jsonl",
      "license": "CC-BY-SA-4.0",
      "attribution": "English Wiktionary (Catalan entries) contributors, extracted via Wiktextract and published by Kaikki.org. Retrieved Wed, 09 Sep 2026 20:44:10 GMT. Source SHA-256 (first 64 MB): c0e8592444c906da638bdde486d9187c74daea0965ec2a45450aac3fd112b684"
    }
  ]
}
